,filename,location,name,release_date,overview,genre,vote_average,vote_count,popularity,cast_top5,trailer,poster,director,runtime
77,Salt.avi,D:/Movies,Salt,2010-07-21,"As a CIA officer, Evelyn Salt swore an oath to duty, honor and country. Her loyalty will be tested when a Russian defector accuses her of being a Russian sleeper spy. She goes on the run, using all her skills and years of experience as a covert operative to elude capture, protect her husband, and stay one step ahead of her colleagues at the CIA. Her efforts to prove her innocence only serve to cast doubt on her motives, as the hunt to uncover the truth behind her identity continues and the question remains: ""Who is Salt?""","Action, Mystery, Thriller",6.414,5801,5.583,"Angelina Jolie as Evelyn Salt
Liev Schreiber as Theodore Winter
Chiwetel Ejiofor as Darryl Peabody
Daniel Olbrychski as Oleg Vasilyevich Orlov
August Diehl as Mike Krause
",https://youtu.be/QZ40WlshNwU,https://image.tmdb.org/t/p/w154/kqeIJG7VjwkcTR26QHg8D01x8yI.jpg,Phillip Noyce,100 min
78,Scott Pilgrim Vs The World.avi,D:/Movies,Scott Pilgrim Vs The World,2010-08-12,"As bass guitarist for a garage-rock band, Scott Pilgrim has never had trouble getting a girlfriend; usually, the problem is getting rid of them. But when Ramona Flowers skates into his heart, he finds she has the most troublesome baggage of all: an army of ex-boyfriends who will stop at nothing to eliminate him from her list of suitors.","Action, Comedy, Romance",7.5,8367,6.8754,"Michael Cera as Scott Pilgrim
Mary Elizabeth Winstead as Ramona Flowers
Ellen Wong as Knives Chau
Kieran Culkin as Wallace Wells
Alison Pill as Kim Pine
",No trailer available,https://image.tmdb.org/t/p/w154/g5IoYeudx9XBEfwNL0fHvSckLBz.jpg,Edgar Wright,113 min
79,Swing Vote.avi,D:/Movies,Swing Vote,1999-04-19,A newly-appointed Supreme Court Justice must settle a controversial moral and legal dilemma with his tie-breaking decision which may also have serious implications on his own family's harmony.,"Drama, TV Movie",5.455,11,1.8394,"Andy Garcia as Joseph Michael Kirkland
Harry Belafonte as Will Dunn
Robert Prosky as Chief Justice
Ray Walston as Justice Clore Cawley
James Whitmore as Daniel Morissey
",No trailer available,https://image.tmdb.org/t/p/w154/azgcPstqDrZNk8X5uKJiKvaAsFn.jpg,David Anspaugh,90 min
80,Taking Woodstock.avi,D:/Movies,Taking Woodstock,2009-08-26,"The story of Elliot Tiber and his family, who inadvertently played a pivotal role in making the famed Woodstock Music and Arts Festival into the happening that it was. When Elliot hears that a neighboring town has pulled the permit on a hippie music festival, he calls the producers thinking he could drum up some much-needed business for his parents' run-down motel. Three weeks later, half a million people are on their way to his neighbor’s farm in White Lake, New York, and Elliot finds himself swept up in a generation-defining experience that would change his life–and American culture–forever.","Music, Comedy, Drama",6.2,465,3.3152,"Demetri Martin as Elliot Teichberg
Imelda Staunton as Sonia Teichberg
Henry Goodman as Jake Teichberg
Jonathan Groff as Michael Lang
Eugene Levy as Max Yasgur
",No trailer available,https://image.tmdb.org/t/p/w154/wIdyAJCvIj3QUoNmmDdnhXpCMpp.jpg,Ang Lee,121 min
81,The A-Team.avi,D:/Movies,The A-Team,2010-06-09,"A man who loves when a plan comes together, Col. Hannibal Smith leads a close-knit team of elite operatives and Iraq War veterans. Framed for a crime they didn't commit, Smith and his men, Capt. H.M. ‘Howling Mad’ Murdock , Sgt. Bosco ‘B.A.’ Baracus, and Lt. Templeton ‘Faceman’ Peck, break out and go rogue, using their special talents to clear their names and find the perpetrator. Hot on their trail is Capt. Charissa Sosa, who was once involved with a member of Smith's team and has sworn to capture them, no matter what it takes.","Action, Comedy, Crime",6.409,4892,8.4631,"Liam Neeson as Hannibal
Bradley Cooper as Face
Jessica Biel as Charisa Sosa
Quinton 'Rampage' Jackson as B.A. Baracus
Sharlto Copley as Murdock
",https://youtu.be/exyzEFrmLuM,https://image.tmdb.org/t/p/w154/bkAWEx5g5tvRPjtDQyvIZ7LRxQm.jpg,Joe Carnahan,117 min
82,The Book Of Eli.avi,D:/Movies,The Book Of Eli,2010-01-14,"A post-apocalyptic tale, in which a lone man fights his way across America in order to protect a sacred book that holds the secrets to saving humankind.","Action, Thriller, Science Fiction",6.796,6516,7.8123,"Denzel Washington as Eli
Gary Oldman as Carnegie
Mila Kunis as Solara
Ray Stevenson as Redridge
Jennifer Beals as Claudia
",https://youtu.be/yAQcwKY0Dik,https://image.tmdb.org/t/p/w154/1H1y9ZiqNFaLgQiRDDZLA55PviW.jpg,"Allen Hughes, Albert Hughes",118 min
83,The Burning Plain.avi,D:/Movies,The Burning Plain,2008-11-07,"A trailer is burning in the middle of a plain. The bodies of two adulterous lovers are found. Scenes from both families, before and after the dramatic events, suggest an unusual connection between them. But what is their secret?","Drama, Romance, Crime",6.568,457,1.2208,"Charlize Theron as Sylvia / Mariana
Kim Basinger as Gina
Jennifer Lawrence as Young Mariana
Joaquim de Almeida as Nick Martinez
John Corbett as John
",No trailer available,https://image.tmdb.org/t/p/w154/lZlChM3LmOLUCQCfnbaf2dQKe9J.jpg,Guillermo Arriaga,111 min
84,The Cry Of The Owl.avi,D:/Movies,The Cry Of The Owl,2009-02-07,"Fleeing New York City, a failed marriage and a fragile mental history, artist Robert Forrester moves to small-town Pennsylvania. There he becomes fascinated with the simple domesticity of a beautiful neighbor, watching her through the windows of her home --- until she invites him in for coffee. He is drawn into a relationship with the young woman whose boyfriend goes missing; Robert becomes a murder suspect, gradually sensing he is the target of a larger plot.","Drama, Mystery, Thriller",5.677,99,0.721,"Paddy Considine as Robert Forrester
Julia Stiles as Jenny Thierolf
Karl Pruner as Mr. Jaffe
Phillip MacKenzie as Lavigne Client
Gord Rand as Jack Nielson
",https://youtu.be/6XvJF56X3YU,https://image.tmdb.org/t/p/w154/h9VizOOadBJixcbpswSqM0bb30c.jpg,Jamie Thraves,101 min
85,The Expendables.avi,D:/Movies,The Expendables,2010-08-07,"Barney Ross leads a band of highly skilled mercenaries including knife enthusiast Lee Christmas, a martial arts expert Yin Yang, heavy weapons specialist Hale Caesar, demolitionist Toll Road, and a loose-cannon sniper Gunner Jensen. When the group is commissioned by the mysterious Mr. Church to assassinate the dictator of a small South American island, Barney and Lee visit the remote locale to scout out their opposition and discover the true nature of the conflict engulfing the city.","Thriller, Adventure, Action",6.249,8129,8.9509,"Sylvester Stallone as Barney Ross
Jason Statham as Lee Christmas
Jet Li as Yin Yang
Dolph Lundgren as Gunner Jensen
Eric Roberts as James Monroe
",https://youtu.be/8KtYRALe-xo,https://image.tmdb.org/t/p/w154/j09ZkH6R4JWVylBcDai1laCmGw7.jpg,Sylvester Stallone,103 min
86,The Four Faced Liar.avi,D:/Movies,The Four Faced Liar,2010-01-21,"A story of love and lies for four twenty-somethings looking to find themselves in New York City. A pair of best friends and a seemingly perfect couple meet at a local Irish pub tucked in the winding streets of the West Village. Through their chance meeting, the four bond and over time all of their relationships with one another morph into love, betrayal and heartbreak for all.","Comedy, Drama, Romance",5.367,60,0.2389,"Marja-Lewis Ryan as Bridget
Emily Peck as Molly
Todd Kubrak as Trip
Liz Osborn as Chloe
Daniel Carlisle as Greg
",https://youtu.be/y15Ym3BFLOY,https://image.tmdb.org/t/p/w154/81Poo7kSBjYGjA7ytdHtu4fhaGN.jpg,Jacob Chase,87 min
87,The Fourth Kind.avi,D:/Movies,The Fourth Kind,2009-11-05,"Since the 1960s, a disproportionate number of the population in and around Nome, Alaska, have gone missing. Despite FBI investigations, the disappearances remain a mystery. Dr. Abigail Tyler, a psychologist, may be on the verge of blowing the unsolved cases wide open when, during the course of treating her patients, she finds evidence of alien abductions.","Mystery, Science Fiction, Thriller",6.335,1834,2.7374,"Milla Jovovich as Dr. Abigail 'Abbey' Tyler
Will Patton as Sheriff August
Hakeem Kae-Kazim as Awolowa Odusami
Corey Johnson as Tommy Fisher
Enzo Cilenti as Scott Stracinsky
",https://youtu.be/JQBU4HvN5MY,https://image.tmdb.org/t/p/w154/vfnsGUwurUQqlpvArBvUVc9rYXa.jpg,Olatunde Osunsanmi,98 min
88,The Killer Inside Me.avi,D:/Movies,The Killer Inside Me,2010-02-19,"Deputy Sheriff Lou Ford is a pillar of the community in his small west Texas town, patient and apparently thoughtful. Some people think he is a little slow and maybe boring, but that is the worst they say about him. But then nobody knows about what Lou calls his ""sickness"": He is a brilliant, but disturbed sociopathic sadist.","Crime, Drama, Thriller",5.828,610,2.0536,"Casey Affleck as Lou Ford
Kate Hudson as Amy Stanton
Jessica Alba as Joyce Lakeland
Ned Beatty as Chester Conway
Tom Bower as Sheriff Bob Maples
",https://youtu.be/BO9lzxOai10,https://image.tmdb.org/t/p/w154/fhmdzywgGF9cvoLPuW8qqDn0Gtx.jpg,Michael Winterbottom,109 min
89,The Other Guys.avi,D:/Movies,The Other Guys,2010-08-06,"Unlike their heroic counterparts on the force, desk-bound NYPD detectives Gamble and Hoitz garner no headlines as they work day to day. When a seemingly minor case turns out to be a big deal, the two cops get the opportunity to finally prove to their comrades that they have the right stuff.","Comedy, Action",6.323,4454,4.2442,"Will Ferrell as Detective Allen Gamble
Mark Wahlberg as Detective Terry Hoitz
Eva Mendes as Sheila Gamble
Michael Keaton as Captain Gene Mauch
Steve Coogan as David Ershon
",https://youtu.be/D6WOoUG1eNo,https://image.tmdb.org/t/p/w154/wNEHNqo3MgHmj3BUiPSqqq5czcm.jpg,Adam McKay,107 min
90,The Sorcerers Apprentice.avi,D:/Movies,The Sorcerers Apprentice,2010-07-13,"Balthazar Blake is a master sorcerer in modern-day Manhattan trying to defend the city from his arch-nemesis, Maxim Horvath. Balthazar can't do it alone, so he recruits Dave Stutler, a seemingly average guy who demonstrates hidden potential, as his reluctant protégé. The sorcerer gives his unwilling accomplice a crash course in the art and science of magic, and together, these unlikely partners work to stop the forces of darkness.","Fantasy, Adventure, Action",6.135,5176,5.4304,"Nicolas Cage as Balthazar Blake
Jay Baruchel as David ""Dave"" Stutler
Alfred Molina as Maxim Horvath
Teresa Palmer as Rebecca ""Becky"" Barnes
Toby Kebbell as Drake Stone
",https://youtu.be/NDPPUJqFgks,https://image.tmdb.org/t/p/w154/b5pIUsGll0418NyfNA5eYCI9aoK.jpg,Jon Turteltaub,109 min
91,The Time Traveler's Wife.avi,D:/Movies,The Time Traveler's Wife,2009-08-14,"Due to a genetic disorder, handsome librarian Henry DeTamble involuntarily zips through time, appearing at various moments in the life of his true love, the beautiful artist Clare Abshire.","Drama, Romance, Fantasy",6.941,2639,4.163,"Eric Bana as Henry DeTamble
Rachel McAdams as Clare Abshire
Michelle Nolden as Annette DeTamble
Arliss Howard as Richard DeTamble
Ron Livingston as Gomez
",No trailer available,https://image.tmdb.org/t/p/w154/J3ewuzQwhFro0pDpdcbZ4j7MYy.jpg,Robert Schwentke,107 min
92,Valhalla Rising.avi,D:/Movies,Valhalla Rising,2009-09-04,"Scandinavia, 1,000 AD. For years, One Eye, a mute warrior of supernatural strength, has been held prisoner by the Norse chieftain Barde. Aided by Are, a boy slave, One Eye slays his captor and together he and Are escape, beginning a journey into the heart of darkness. On their flight, One Eye and Are board a Viking vessel, but the ship is soon engulfed by an endless fog that clears only as the crew sights an unknown land. As the new world reveals its secrets and the Vikings confront their terrible and bloody fate, One Eye discovers his true self.","Adventure, Drama, Action, Fantasy",6.11,1292,7.8577,"Mads Mikkelsen as One-Eye
Gary Lewis as Kare
Jamie Sives as Gorm
Ewan Stewart as Eirik
Alexander Morton as Barde
",No trailer available,https://image.tmdb.org/t/p/w154/7LBMcAx6XHwEduIsBYipvUke9n.jpg,Nicolas Winding Refn,93 min
93,Vampires Suck.avi,D:/Movies,Vampires Suck,2010-08-18,"Becca, an anxious, non-vampire teen is torn between two boys. Before she can choose, Becca must get around her controlling father, who treats her like a child. Meanwhile, Becca's friends contend with their own romantic issues – all of which collide at the prom.","Comedy, Fantasy",4.394,1372,4.6531,"Jenn Proske as Becca Crane
Matt Lanter as Edward
Chris Riggi as Jacob White
Diedrich Bader as Frank Crane
Anneliese Van Der Pol as Jennifer
",https://youtu.be/Gw1oGbdXzoU,https://image.tmdb.org/t/p/w154/ksPKfoXovAiFnBktkCBefsRQ8a1.jpg,"Jason Friedberg, Aaron Seltzer",82 min
94,Walk the Line.avi,D:/Movies,Walk the,2025-09-10,"In a dystopian near-future America, fifty teenage boys take part in a deadly annual walking contest, forced to maintain a minimum pace or be executed, until only one survivor remains.","Science Fiction, Thriller, Horror",6.9,1090,18.0692,"Cooper Hoffman as Raymond Garraty #47
David Jonsson as Peter McVries #23
Garrett Wareing as Stebbins #38
Tut Nyuot as Arthur Baker #6
Charlie Plummer as Gary Barkovitch #5
",https://youtu.be/vAtUHeMQ1F8,https://image.tmdb.org/t/p/w154/wobVTa99eW0ht6c1rNNzLkazPtR.jpg,Francis Lawrence,108 min
95,Wall Street Money Never Sleeps.avi,D:/Movies,Wall Street Money Never Sleeps,2010-09-20,"As the global economy teeters on the brink of disaster, a young Wall Street trader partners with disgraced former Wall Street corporate raider Gordon Gekko on a two tiered mission: To alert the financial community to the coming doom, and to find out who was responsible for the death of the young trader's mentor.","Drama, Crime",6.09,1639,3.5742,"Michael Douglas as Gordon Gekko
Shia LaBeouf as Jacob Moore
Josh Brolin as Bretton James
Carey Mulligan as Winnie Gekko
Frank Langella as Lewis Zabel
",https://youtu.be/q7j8leLG8fc,https://image.tmdb.org/t/p/w154/sA7dP4TJdbIF6a9xNeuBeHOGioX.jpg,Oliver Stone,133 min
96,Agora.avi,D:/Movies,Agora,2009-05-17,"A historical drama set in Roman Egypt, concerning philosopher Hypatia of Alexandria and her relationship with her slave Davus, who is torn between his love for her and the possibility of gaining his freedom by joining the rising tide of Christianity.","Adventure, Drama, History",6.988,1519,4.1404,"Rachel Weisz as Hypatia
Max Minghella as Davus
Oscar Isaac as Orestes
Ashraf Barhom as Ammonius
Michael Lonsdale as Theon
",https://youtu.be/RbuEhwselE0,https://image.tmdb.org/t/p/w154/1xsFa6I5vDd2UI1AJ1tsW7BUChv.jpg,Alejandro Amenábar,127 min
97,Angels & Demons .avi,D:/Movies,Angels & Demons .,2009-04-20,"Harvard symbologist Robert Langdon is recruited by the Vatican to investigate the apparent return of the Illuminati – a secret, underground organization – after four cardinals are kidnapped on the night of the papal conclave.","Thriller, Mystery",6.716,7176,7.6737,"Tom Hanks as Robert Langdon
Ewan McGregor as Camerlengo Patrick McKenna
Ayelet Zurer as Vittoria Vetra
Stellan Skarsgård as Commander Richter
Pierfrancesco Favino as Inspector Olivetti
",No trailer available,https://image.tmdb.org/t/p/w154/tFZQAuulEOtFTp0gHbVdEXwGrYe.jpg,Ron Howard,139 min
98,Beats of Freedom.avi,D:/Movies,Beats of Freedom,2010-03-12,"A journey through three decades of Polish rock music. It begins with the famous Rolling Stones concert in Warsaw in 1967 and then goes on to show music’s significance during the wave of strikes in June 1980, which led to the birth of the Solidarity trade union.","Documentary, Music",7.8,5,0.0759,,No trailer available,https://image.tmdb.org/t/p/w154/Al2zy17XTss26BN4OjvUwf4hGzy.jpg,"Wojciech Słota, Leszek Gnoiński",73 min
99,Clash Of The Titans.avi,D:/Movies,Clash Of The Titans,2010-03-26,"Born of a god but raised as a man, Perseus is helpless to save his family from Hades, vengeful god of the underworld. With nothing to lose, Perseus volunteers to lead a dangerous mission to defeat Hades before he can seize power from Zeus and unleash hell on earth. Battling unholy demons and fearsome beasts, Perseus and his warriors will only survive if Perseus accepts his power as a god, defies fate and creates his own destiny.","Adventure, Fantasy, Action",5.92,6551,5.9052,"Sam Worthington as Perseus
Gemma Arterton as Io
Mads Mikkelsen as Draco
Alexa Davalos as Andromeda
Jason Flemyng as Calibos / Acrisius
",https://youtu.be/mUbf2f5aDoE,https://image.tmdb.org/t/p/w154/6iHYLipwEyZUPNO8MM3l1yHDaFE.jpg,Louis Leterrier,106 min
100,Cop Out.avi,D:/Movies,Cop Out,2010-02-26,"Detectives Jimmy and Paul, despite nine years as partners, can still sometimes seem like polar opposites—especially when Paul's unpredictable antics get them suspended without pay. Already strapped for cash and trying to pay for his daughter's wedding, Jimmy decides to sell a rare baseball card that's worth tens of thousands. Unfortunately, when the collector's shop is robbed and the card vanishes with the crook, Paul and Jimmy end up going rogue, tracking down the card and the drug ring behind its theft, all on their own time and without any backup—except for each other.","Action, Comedy, Crime",5.551,1590,2.5918,"Bruce Willis as Jimmy Monroe
Tracy Morgan as Paul Hodges
Adam Brody as Barry Mangold
Kevin Pollak as Hunsaker
Ana de la Reguera as Gabriela
",https://youtu.be/NAH8qgVY9jE,https://image.tmdb.org/t/p/w154/qA31i7FPVDHezuoevx3497CvZd4.jpg,Kevin Smith,107 min
101,Death At A Funeral.avi,D:/Movies,Death At A Funeral,2007-08-17,A myriad of outrageous calamities befalls an eccentric English clan with more than a few skeletons in its closets when the family's patriarch dies an unexpected death.,"Comedy, Drama",6.912,1873,2.0501,"Matthew Macfadyen as Daniel
Peter Dinklage as Peter
Ewen Bremner as Justin
Keeley Hawes as Jane
Andy Nyman as Howard
",https://youtu.be/SPbXMBZhFc8,https://image.tmdb.org/t/p/w154/xyTxrJnjbSJQzcbKIP6S1uqLuxy.jpg,Frank Oz,91 min
102,Education.avi,D:/Movies,Education,2020-12-13,"A Black boy’s journey through an ineffectual public school system reveals the racial inequities built into everyday British life. Young Kingsley Smith (Kenyah Sandy) is a spirited aspiring astronaut with a love of drawing whose life is turned upside down when he is thrust into a new school for the “educationally subnormal”—a harrowing experience that gradually awakens his mother (Sharlene Whyte) to the institutional mistreatment of the children of West Indian immigrants. Shot on Super 16 mm to evoke BBC television dramas from the 1970s, the final Small Axe film concludes the pentalogy with a hopeful vision of the power of Black-led collective action.",Drama,0.0,0,0.1901,"Kenyah Sandy as Kingsley
Naomi Ackie as Hazel
Jade Anouka as Mrs. Morrison
Sharlene Whyte as Mother
Temirlan Blaev as Pupil
",https://youtu.be/9uxPGMubvbQ,https://image.tmdb.org/t/p/w154/c8hZx3vqTKcLlDyDp3P0h5gtreV.jpg,Steve McQueen,66 min
103,A.Charlie.Brown.Christmas.1965.720p.BRRip.XviD.AC3-ViSiON.avi,D:/Movies,A Charlie Brown Christmas,1965-12-09,"When Charlie Brown complains about the overwhelming materialism that he sees amongst everyone during the Christmas season, Lucy suggests that he become director of the school Christmas pageant. Charlie Brown accepts, but it is a frustrating struggle. When an attempt to restore the proper spirit with a forlorn little fir Christmas tree fails, he needs Linus' help to learn the meaning of Christmas.","Animation, Family, Comedy, TV Movie",7.7,757,1.8519,"Peter Robbins as Charlie Brown (voice)
Christopher Shea as Linus Van Pelt (voice)
Tracy Stratford as Lucy Van Pelt (voice)
Cathy Steinberg as Sally Brown (voice)
Chris Doran as Schroeder / Shermy (voice)
",No trailer available,https://image.tmdb.org/t/p/w154/vtaufTzJBMJAeziQA1eP4BLU24C.jpg,Bill Melendez,25 min
104,The Princess Bride.avi,D:/Movies,The Princess Bride,1987-09-25,"In this enchantingly cracked fairy tale, the beautiful Princess Buttercup and the dashing Westley must overcome staggering odds to find happiness amid six-fingered swordsmen, murderous princes, Sicilians and rodents of unusual size. But even death can't stop these true lovebirds from triumphing.","Adventure, Family, Fantasy, Comedy, Romance",7.69,4948,8.5865,"Cary Elwes as Westley
Robin Wright as The Princess Bride
Mandy Patinkin as Inigo Montoya
Chris Sarandon as Prince Humperdinck
Christopher Guest as Count Rugen
",https://youtu.be/Nq30P5tEY0I,https://image.tmdb.org/t/p/w154/2FC9L9MrjBoGHYjYZjdWQdopVYb.jpg,Rob Reiner,99 min
105,Elf.avi,D:/Movies,Elf,2003-11-07,"When young Buddy falls into Santa's gift sack on Christmas Eve, he's transported back to the North Pole and raised as a toy-making elf by Santa's helpers. But as he grows into adulthood, he can't shake the nagging feeling that he doesn't belong. Buddy vows to visit Manhattan and find his real dad, a workaholic.","Comedy, Family, Fantasy",6.666,4442,6.2523,"Will Ferrell as Buddy
James Caan as Walter
Bob Newhart as Papa Elf
Ed Asner as Santa
Mary Steenburgen as Emily
",https://youtu.be/GA8EcNisRvA,https://image.tmdb.org/t/p/w154/oOleziEempUPu96jkGs0Pj6tKxj.jpg,Jon Favreau,97 min
106,Indiana.Jones.And.The.Kingdom.Of.The.Crystal.Skull[2008]DvDrip-aXXo.avi,D:/Movies,Indiana Jones And The Kingdom Of The Crystal Skull,2008-05-21,"Set during the Cold War, the Soviets—led by sword-wielding Irina Spalko—are in search of a crystal skull which has supernatural powers related to a mystical Lost City of Gold. Indy is coerced to head to Peru at the behest of a young man whose friend—and Indy's colleague—Professor Oxley has been captured for his knowledge of the skull's whereabouts.","Adventure, Action",6.018,8831,7.9032,"Harrison Ford as Indiana Jones
Cate Blanchett as Irina Spalko
Karen Allen as Marion Ravenwood
Shia LaBeouf as Mutt Williams
Ray Winstone as George 'Mac' McHale
",https://youtu.be/nMhfESAa4tw,https://image.tmdb.org/t/p/w154/56As6XEM1flWvprX4LgkPl8ii4K.jpg,Steven Spielberg,122 min
107,Indiana Jones  and the temple of doom.avi,D:/Movies,Indiana Jones  and the temple of doom,1984-05-23,"After arriving in India, Indiana Jones is asked by a desperate village to find a mystical stone. He agrees – and stumbles upon a secret cult plotting a terrible plan in the catacombs of an ancient palace.","Adventure, Action",7.302,9897,10.2259,"Harrison Ford as Indiana Jones
Kate Capshaw as Willie Scott
Ke Huy Quan as Short Round
Amrish Puri as Mola Ram
Roshan Seth as Chattar Lal
",No trailer available,https://image.tmdb.org/t/p/w154/gpdVNUaa4LhRMLfJOPj1AZdhAZ3.jpg,Steven Spielberg,118 min
108,Doctor Zhivago.avi,D:/Movies,Doctor Zhivago,1965-12-22,"The life of a Russian physician and poet who, although married to another, falls in love with a political activist's wife and experiences hardship during World War I and then the October Revolution.","Drama, Romance, War",7.542,1240,2.9219,"Omar Sharif as Dr. Yuri Zhivago
Julie Christie as Lara Antipova
Geraldine Chaplin as Tonya Gromeko
Rod Steiger as Viktor Komarovsky
Alec Guinness as Gen. Yevgraf Zhivago
",No trailer available,https://image.tmdb.org/t/p/w154/r0Iv2BiCFYDnzc6uU1q3AJ56igT.jpg,David Lean,200 min
109,Tron [20th Anniversary Collector's Edition] [1982].avi,D:/Movies,Tron,1982-07-09,"When brilliant video game maker Flynn hacks the mainframe of his ex-employer, he is beamed inside an astonishing digital world and becomes part of the very game he is designing. In his mission through cyberspace, Flynn matches wits with a maniacal Master Control Program and teams up with Tron, a security measure created to bring balance to the digital environment.","Science Fiction, Action, Adventure",6.637,2640,7.5687,"Jeff Bridges as Kevin Flynn / Clu
Bruce Boxleitner as Alan Bradley / Tron
David Warner as Ed Dillinger / Sark
Cindy Morgan as Lora / Yori
Barnard Hughes as Dr. Walter Gibbs / Dumont
",No trailer available,https://image.tmdb.org/t/p/w154/jigY9B6TKz4qlfikZcd18qtzTK4.jpg,Steven Lisberger,95 min
110,The_Nightmare_Before_Christmas.avi,D:/Movies,The Nightmare Before Christmas,1993-10-09,"Tired of scaring humans every October 31 with the same old bag of tricks, Jack Skellington, the spindly king of Halloween Town, kidnaps Santa Claus and plans to deliver shrunken heads and other ghoulish gifts to children on Christmas morning. But as Christmas approaches, Jack's rag-doll girlfriend, Sally, tries to foil his misguided plans.","Fantasy, Animation, Family",7.831,10144,8.8694,"Danny Elfman as Jack Skellington (singing) / Barrel / Clown with the Tear away Face (voice)
Chris Sarandon as Jack Skellington (voice)
Catherine O'Hara as Sally / Shock (voice)
William Hickey as Dr. Finkelstein (voice)
Glenn Shadix as Mayor (voice)
",No trailer available,https://image.tmdb.org/t/p/w154/oQffRNjK8e19rF7xVYEN8ew0j7b.jpg,Henry Selick,76 min
111,The Kings Speech.avi,D:/Movies,The Kings Speech,2010-11-26,"The King's Speech tells the story of the man who became King George VI, the father of Queen Elizabeth II. After his brother abdicates, George ('Bertie') reluctantly assumes the throne. Plagued by a dreaded stutter and considered unfit to be king, Bertie engages the help of an unorthodox speech therapist named Lionel Logue. Through a set of unexpected techniques, and as a result of an unlikely friendship, Bertie is able to find his voice and boldly lead the country into war.","Drama, History",7.733,9131,4.5279,"Colin Firth as King George VI
Geoffrey Rush as Lionel Logue
Helena Bonham Carter as Queen Elizabeth
Guy Pearce as King Edward VIII
Timothy Spall as Winston Churchill
",https://youtu.be/HXMqX9s67kY,https://image.tmdb.org/t/p/w154/pVNKXVQFukBaCz6ML7GH3kiPlQP.jpg,Tom Hooper,118 min
